<!ELEMENT personas (persona+)>
<!ELEMENT persona (nombre,apellido,edad)>
<!ELEMENT nombre (#PCDATA)>
<!ELEMENT apellido (#PCDATA)>
<!ELEMENT edad (#PCDATA)>